{
  "schema_version": "awkp/0.1",
  "task_id": "TASK-0073",
  "context_id": "CTX-workflow-b-reliability",
  "state": "completed",
  "state_version": 3,
  "attempt": 1,
  "owner": null,
  "lease": null,
  "next_action": "Completed by EvidenceGate verifier approval.",
  "pause_reason": null,
  "blockers": [],
  "artifact_refs": [
    "ART-TASK-0073-RESTORE-0001",
    "ART-TASK-0073-RESTORE-0002",
    "ART-TASK-0073-HANDOFF-RESTORE-0001",
    "ART-TASK-0073-0001"
  ],
  "evidence_refs": [
    "EVD-TASK-0073-RESTORE-0001",
    "EVD-TASK-0073-RESTORE-0002",
    "EVD-TASK-0073-0001"
  ],
  "updated_at": "2026-07-01T12:30:00.000002Z"
}
