{
  "schema_version": "awkp/0.1",
  "task_id": "TASK-0011",
  "context_id": "CTX-ahra-durable-control-plane-boundary",
  "state": "canceled",
  "state_version": 2,
  "owner": null,
  "attempt": 0,
  "lease": null,
  "next_action": "No action under the old backlog; see CTX-ahra-dynamic-kernel and TASK-0021 reconciliation.",
  "pause_reason": "superseded_by_dynamic_kernel",
  "blockers": [],
  "artifact_refs": [],
  "evidence_refs": [],
  "updated_at": "2026-06-25T12:31:28+08:00"
}
