{
  "artifact_refs": [
    "ART-TASK-0045-0001",
    "ART-TASK-0045-0002",
    "ART-TASK-0045-0003",
    "ART-TASK-0045-0004",
    "ART-TASK-0045-0005",
    "ART-TASK-0045-0006",
    "ART-TASK-0045-0007",
    "ART-TASK-0045-0008",
    "ART-TASK-0045-0009",
    "ART-TASK-0045-HANDOFF-0001",
    "ART-TASK-0045-0010",
    "ART-TASK-0045-0011"
  ],
  "attempt": 1,
  "blockers": [],
  "context_id": "CTX-ahra-dynamic-kernel",
  "evidence_refs": [
    "EVD-TASK-0045-0001",
    "EVD-TASK-0045-0002",
    "EVD-TASK-0045-0003",
    "EVD-TASK-0045-0004",
    "EVD-TASK-0045-0005",
    "EVD-TASK-0045-0006",
    "EVD-TASK-0045-0007",
    "EVD-TASK-0045-0008",
    "EVD-TASK-0045-0009",
    "EVD-TASK-0045-0010",
    "EVD-TASK-0045-0011"
  ],
  "lease": null,
  "next_action": "Completed by EvidenceGate verifier approval.",
  "owner": null,
  "pause_reason": null,
  "schema_version": "awkp/0.1",
  "state": "completed",
  "state_version": 7,
  "task_id": "TASK-0045",
  "updated_at": "2026-06-28T08:57:30.803741Z"
}
