{
  "schema_version": "awkp/0.1",
  "task_id": "TASK-0058",
  "context_id": "CTX-workflow-autonomy",
  "state": "ready",
  "state_version": 0,
  "attempt": 0,
  "owner": null,
  "lease": null,
  "next_action": "After TASK-0057, expose ahra task create and ahra task claim using the governed CAS writer.",
  "pause_reason": null,
  "blockers": [],
  "artifact_refs": [],
  "evidence_refs": [],
  "updated_at": "2026-06-29T11:00:00Z"
}
